{
  "author_unknown": {
    "census_2026_09_13": "never_classified = 476,679 of 731,153 live (65.2%); both-NULL = 65,017; classified_unknown literal not observed on the copy",
    "classified_unknown": {
      "count": 2,
      "definition": "provenance_class = 'unknown', archived_at IS NULL",
      "share": 0.076923
    },
    "inputs": [
      {
        "mtime": "2026-09-13T12:00:00Z",
        "path": "db/missing-log-dev.sqlite",
        "rows_or_bytes": 27,
        "sha256_first_64kb": null,
        "skipped_lines": 2,
        "status": "read"
      }
    ],
    "never_classified": {
      "count": 6,
      "definition": "provenance_class IS NULL OR source_class IS NULL, archived_at IS NULL",
      "share": 0.230769
    },
    "reason": "",
    "state": "measured",
    "top_source_files": [
      {
        "count": 4,
        "source_file": "brainbar-store"
      },
      {
        "count": 4,
        "source_file": "realtime-hook"
      }
    ],
    "trend_7d": [
      {
        "classified_unknown": 0,
        "day": "2026-09-07",
        "never_classified": 1
      },
      {
        "classified_unknown": 1,
        "day": "2026-09-08",
        "never_classified": 1
      },
      {
        "classified_unknown": 0,
        "day": "2026-09-09",
        "never_classified": 0
      },
      {
        "classified_unknown": 0,
        "day": "2026-09-10",
        "never_classified": 0
      },
      {
        "classified_unknown": 0,
        "day": "2026-09-11",
        "never_classified": 0
      },
      {
        "classified_unknown": 0,
        "day": "2026-09-12",
        "never_classified": 0
      },
      {
        "classified_unknown": 1,
        "day": "2026-09-13",
        "never_classified": 2
      }
    ]
  },
  "backups": {
    "inputs": [
      {
        "mtime": null,
        "path": "logs/missing-log-dev/jsonl-backup.log",
        "rows_or_bytes": null,
        "sha256_first_64kb": null,
        "skipped_lines": 0,
        "status": "missing"
      },
      {
        "mtime": "2026-09-13T12:00:00Z",
        "path": "logs/missing-log-dev/backup-daily.log",
        "rows_or_bytes": 373,
        "sha256_first_64kb": "ee25e3181dd68fa793f75ce96e04e2b086758b1effd39b834e2f39b47ec2cde0",
        "skipped_lines": 2,
        "status": "read"
      },
      {
        "mtime": "2026-09-13T12:00:00Z",
        "path": "launchd/missing-log-dev.txt",
        "rows_or_bytes": 101,
        "sha256_first_64kb": "c7e7fae25ca60561a06ba1439384c7ea3b89257fd2e8e133fcef611e9a6fe8e2",
        "skipped_lines": 0,
        "status": "read"
      }
    ],
    "reason": "required input missing: logs/missing-log-dev/jsonl-backup.log",
    "state": "unmeasurable"
  },
  "db_path": "db/missing-log-dev.sqlite",
  "emitters": {
    "by_emitter": [
      {
        "count_in_window": 2,
        "derived_from": "sender",
        "emitter": "assistant"
      },
      {
        "count_in_window": 2,
        "derived_from": "source",
        "emitter": "claude_code"
      },
      {
        "count_in_window": 2,
        "derived_from": "source",
        "emitter": "codex_cli"
      },
      {
        "count_in_window": 2,
        "derived_from": "source",
        "emitter": "mcp"
      },
      {
        "count_in_window": 2,
        "derived_from": "source_file",
        "emitter": "realtime-hook"
      },
      {
        "count_in_window": 2,
        "derived_from": "source",
        "emitter": "realtime_watcher"
      }
    ],
    "by_source_class": [
      {
        "count": 2,
        "in_window": 1,
        "source_class": "brain-worker"
      },
      {
        "count": 9,
        "in_window": 4,
        "source_class": "cli-agent"
      },
      {
        "count": 4,
        "in_window": 2,
        "source_class": "desktop"
      },
      {
        "count": 4,
        "in_window": 2,
        "source_class": "fleet-coordination"
      },
      {
        "count": 2,
        "in_window": 1,
        "source_class": "subagent"
      },
      {
        "count": 6,
        "in_window": 2,
        "source_class": null
      }
    ],
    "derivation_note": "metadata.attributionAgent is absent in the 2026-09-13 census; emitter derives from source, then sender, then source_file, or the section is unmeasurable",
    "hidden_from_default_search": 6,
    "inputs": [
      {
        "mtime": "2026-09-13T12:00:00Z",
        "path": "db/missing-log-dev.sqlite",
        "rows_or_bytes": 27,
        "sha256_first_64kb": null,
        "skipped_lines": 2,
        "status": "read"
      }
    ],
    "reason": "",
    "state": "measured"
  },
  "generated_at": "2026-09-13T12:00:00Z",
  "schema_version": 1,
  "stores": {
    "by_content_class": [
      {
        "content_class": "decision",
        "count": 6
      },
      {
        "content_class": "knowledge",
        "count": 9
      },
      {
        "content_class": "operational",
        "count": 6
      },
      {
        "content_class": "test",
        "count": 6
      }
    ],
    "in_window": {
      "by_hour": [
        {
          "count": 1,
          "hour": "2026-09-13T01:00:00Z"
        },
        {
          "count": 1,
          "hour": "2026-09-13T02:00:00Z"
        },
        {
          "count": 1,
          "hour": "2026-09-13T03:00:00Z"
        },
        {
          "count": 1,
          "hour": "2026-09-13T04:00:00Z"
        },
        {
          "count": 1,
          "hour": "2026-09-13T05:00:00Z"
        },
        {
          "count": 1,
          "hour": "2026-09-13T06:00:00Z"
        },
        {
          "count": 1,
          "hour": "2026-09-13T07:00:00Z"
        },
        {
          "count": 1,
          "hour": "2026-09-13T08:00:00Z"
        },
        {
          "count": 1,
          "hour": "2026-09-13T09:00:00Z"
        },
        {
          "count": 1,
          "hour": "2026-09-13T10:00:00Z"
        },
        {
          "count": 1,
          "hour": "2026-09-13T11:00:00Z"
        },
        {
          "count": 1,
          "hour": "2026-09-13T12:00:00Z"
        }
      ],
      "count": 12
    },
    "inputs": [
      {
        "mtime": "2026-09-13T12:00:00Z",
        "path": "db/missing-log-dev.sqlite",
        "rows_or_bytes": 27,
        "sha256_first_64kb": null,
        "skipped_lines": 2,
        "status": "read"
      }
    ],
    "latest": [
      {
        "chunk_id": "synthetic-00",
        "emitter": "realtime_watcher",
        "preview": "Synthetic observability fixture row 00",
        "source_class": "cli-agent",
        "stored_at": "2026-09-13T12:00:00Z"
      },
      {
        "chunk_id": "synthetic-01",
        "emitter": "claude_code",
        "preview": "Synthetic observability fixture row 01",
        "source_class": "cli-agent",
        "stored_at": "2026-09-13T11:00:00Z"
      },
      {
        "chunk_id": "synthetic-02",
        "emitter": "codex_cli",
        "preview": "Synthetic observability fixture row 02",
        "source_class": "cli-agent",
        "stored_at": "2026-09-13T10:00:00Z"
      },
      {
        "chunk_id": "synthetic-03",
        "emitter": "mcp",
        "preview": "Synthetic observability fixture row 03",
        "source_class": "fleet-coordination",
        "stored_at": "2026-09-13T09:00:00Z"
      },
      {
        "chunk_id": "synthetic-04",
        "emitter": "assistant",
        "preview": "Synthetic observability fixture row 04",
        "source_class": "cli-agent",
        "stored_at": "2026-09-13T08:00:00Z"
      }
    ],
    "reason": "",
    "state": "measured",
    "total_chunks": 27
  },
  "window_hours": 24
}
